[
  {
    "id": "cpp001", "chapterId": "c-basics", "chapterName": "C 基础与运算", "chapterOrder": 1,
    "type": "single", "stem": "下列哪个是合法的 C/C++ 标识符？",
    "options": [{"id":"A","label":"A","text":"2value"},{"id":"B","label":"B","text":"user-name"},{"id":"C","label":"C","text":"total_count"},{"id":"D","label":"D","text":"class"}],
    "correctOptionIds": ["C"], "explanation": "标识符不能以数字开头，不能包含连字符，也不能使用关键字；total_count 符合规则。",
    "difficulty": 1, "tags": ["标识符", "关键字"], "status": "active", "version": 1
  },
  {
    "id": "cpp002", "chapterId": "c-basics", "chapterName": "C 基础与运算", "chapterOrder": 1,
    "type": "single", "stem": "按照 C/C++ 标准，sizeof(char) 的结果是多少？",
    "options": [{"id":"A","label":"A","text":"1"},{"id":"B","label":"B","text":"2"},{"id":"C","label":"C","text":"4"},{"id":"D","label":"D","text":"由编译器决定，可能为 0"}],
    "correctOptionIds": ["A"], "explanation": "标准规定 sizeof(char)、sizeof(signed char) 和 sizeof(unsigned char) 都为 1 个字节。",
    "difficulty": 1, "tags": ["sizeof", "基本类型"], "status": "active", "version": 1
  },
  {
    "id": "cpp003", "chapterId": "c-basics", "chapterName": "C 基础与运算", "chapterOrder": 1,
    "type": "single", "stem": "表达式 7 / 2 的两个操作数都是 int，结果是多少？",
    "options": [{"id":"A","label":"A","text":"3"},{"id":"B","label":"B","text":"3.5"},{"id":"C","label":"C","text":"4"},{"id":"D","label":"D","text":"编译错误"}],
    "correctOptionIds": ["A"], "explanation": "两个整数相除执行整数除法，小数部分向零截断，因此结果为 3。",
    "difficulty": 1, "tags": ["整数除法", "表达式"], "status": "active", "version": 1
  },
  {
    "id": "cpp004", "chapterId": "c-basics", "chapterName": "C 基础与运算", "chapterOrder": 1,
    "type": "single", "stem": "表达式 2 + 3 * 4 的值是多少？",
    "options": [{"id":"A","label":"A","text":"14"},{"id":"B","label":"B","text":"20"},{"id":"C","label":"C","text":"24"},{"id":"D","label":"D","text":"9"}],
    "correctOptionIds": ["A"], "explanation": "乘法优先级高于加法，先计算 3 * 4，再加 2，结果为 14。",
    "difficulty": 1, "tags": ["运算符", "优先级"], "status": "active", "version": 1
  },
  {
    "id": "cpp005", "chapterId": "c-basics", "chapterName": "C 基础与运算", "chapterOrder": 1,
    "type": "multiple", "stem": "下列哪些写法表示整数常量？",
    "options": [{"id":"A","label":"A","text":"10"},{"id":"B","label":"B","text":"012"},{"id":"C","label":"C","text":"0x10"},{"id":"D","label":"D","text":"3.14"}],
    "correctOptionIds": ["A","B","C"], "explanation": "10 是十进制整数，012 是八进制整数，0x10 是十六进制整数；3.14 是浮点常量。",
    "difficulty": 1, "tags": ["整数常量", "进制"], "status": "active", "version": 1
  },
  {
    "id": "cpp006", "chapterId": "c-basics", "chapterName": "C 基础与运算", "chapterOrder": 1,
    "type": "judge", "stem": "C 和 C++ 的标识符都区分大小写，因此 value 与 Value 是两个不同的名称。",
    "options": [{"id":"A","label":"A","text":"正确"},{"id":"B","label":"B","text":"错误"}],
    "correctOptionIds": ["A"], "explanation": "两种语言的标识符都区分大小写，大小写不同会被视为不同标识符。",
    "difficulty": 1, "tags": ["标识符", "大小写"], "status": "active", "version": 1
  },
  {
    "id": "cpp007", "chapterId": "c-basics", "chapterName": "C 基础与运算", "chapterOrder": 1,
    "type": "single", "stem": "表达式 5 % 2 的值是多少？",
    "options": [{"id":"A","label":"A","text":"0"},{"id":"B","label":"B","text":"1"},{"id":"C","label":"C","text":"2"},{"id":"D","label":"D","text":"2.5"}],
    "correctOptionIds": ["B"], "explanation": "% 计算整数除法的余数，5 除以 2 的余数为 1。",
    "difficulty": 1, "tags": ["取模", "运算符"], "status": "active", "version": 1
  },
  {
    "id": "cpp008", "chapterId": "c-basics", "chapterName": "C 基础与运算", "chapterOrder": 1,
    "type": "single", "stem": "在源代码中，'A' 与 \"A\" 的主要区别是什么？",
    "options": [{"id":"A","label":"A","text":"'A' 是字符常量，\"A\" 是包含终止符的字符串字面量"},{"id":"B","label":"B","text":"两者完全相同"},{"id":"C","label":"C","text":"'A' 是字符串，\"A\" 是字符"},{"id":"D","label":"D","text":"两者都会被当作整数数组"}],
    "correctOptionIds": ["A"], "explanation": "单引号表示字符常量；双引号表示字符串字面量，内容还包含结尾的空字符。",
    "difficulty": 1, "tags": ["字符", "字符串"], "status": "active", "version": 1
  },
  {
    "id": "cpp009", "chapterId": "c-basics", "chapterName": "C 基础与运算", "chapterOrder": 1,
    "type": "single", "stem": "使用 scanf 读取一个 double 变量时应使用哪个格式说明符？",
    "options": [{"id":"A","label":"A","text":"%d"},{"id":"B","label":"B","text":"%f"},{"id":"C","label":"C","text":"%lf"},{"id":"D","label":"D","text":"%c"}],
    "correctOptionIds": ["C"], "explanation": "scanf 中 %f 对应 float*，%lf 对应 double*，因此读取 double 应使用 %lf。",
    "difficulty": 2, "tags": ["输入输出", "double"], "status": "active", "version": 1
  },
  {
    "id": "cpp010", "chapterId": "c-basics", "chapterName": "C 基础与运算", "chapterOrder": 1,
    "type": "single", "stem": "执行 int x = (1, 2, 3); 后，x 的值是多少？",
    "options": [{"id":"A","label":"A","text":"1"},{"id":"B","label":"B","text":"2"},{"id":"C","label":"C","text":"3"},{"id":"D","label":"D","text":"6"}],
    "correctOptionIds": ["C"], "explanation": "逗号运算符从左到右计算各表达式，并以最后一个表达式的值作为整体结果。",
    "difficulty": 2, "tags": ["逗号运算符", "表达式"], "status": "active", "version": 1
  },
  {
    "id": "cpp011", "chapterId": "c-basics", "chapterName": "C 基础与运算", "chapterOrder": 1,
    "type": "multiple", "stem": "下列哪些属于逻辑运算符？",
    "options": [{"id":"A","label":"A","text":"&&"},{"id":"B","label":"B","text":"||"},{"id":"C","label":"C","text":"!"},{"id":"D","label":"D","text":"&"}],
    "correctOptionIds": ["A","B","C"], "explanation": "&&、||、! 分别是逻辑与、逻辑或、逻辑非；单个 & 是按位与，也可用于取地址。",
    "difficulty": 1, "tags": ["逻辑运算符", "按位运算"], "status": "active", "version": 1
  },
  {
    "id": "cpp012", "chapterId": "c-basics", "chapterName": "C 基础与运算", "chapterOrder": 1,
    "type": "judge", "stem": "在 C/C++ 中，赋值表达式本身具有值，其值是赋值完成后左操作数的值。",
    "options": [{"id":"A","label":"A","text":"正确"},{"id":"B","label":"B","text":"错误"}],
    "correctOptionIds": ["A"], "explanation": "赋值不仅产生副作用，也会得到一个值，因此可以进行链式赋值等操作。",
    "difficulty": 2, "tags": ["赋值", "表达式"], "status": "active", "version": 1
  },
  {
    "id": "cpp013", "chapterId": "control-functions", "chapterName": "流程控制与函数", "chapterOrder": 2,
    "type": "single", "stem": "没有花括号消除歧义时，else 会与哪个 if 匹配？",
    "options": [{"id":"A","label":"A","text":"同一语句中最近且尚未匹配的 if"},{"id":"B","label":"B","text":"最外层 if"},{"id":"C","label":"C","text":"第一个 if"},{"id":"D","label":"D","text":"由运行时决定"}],
    "correctOptionIds": ["A"], "explanation": "语法规则规定 else 与最近的、尚未配对的 if 匹配；实际编程应使用花括号提升可读性。",
    "difficulty": 1, "tags": ["if", "else"], "status": "active", "version": 1
  },
  {
    "id": "cpp014", "chapterId": "control-functions", "chapterName": "流程控制与函数", "chapterOrder": 2,
    "type": "single", "stem": "下列循环体会执行多少次？",
    "code": "for (int i = 0; i < 5; ++i) {\n    /* 循环体 */\n}",
    "options": [{"id":"A","label":"A","text":"4 次"},{"id":"B","label":"B","text":"5 次"},{"id":"C","label":"C","text":"6 次"},{"id":"D","label":"D","text":"无限次"}],
    "correctOptionIds": ["B"], "explanation": "i 依次取 0、1、2、3、4，共执行 5 次；当 i 变为 5 时条件为假。",
    "difficulty": 1, "tags": ["for", "循环"], "status": "active", "version": 1
  },
  {
    "id": "cpp015", "chapterId": "control-functions", "chapterName": "流程控制与函数", "chapterOrder": 2,
    "type": "multiple", "stem": "关于 while 与 do-while，下列说法哪些正确？",
    "options": [{"id":"A","label":"A","text":"while 循环体可能一次也不执行"},{"id":"B","label":"B","text":"do-while 循环体至少执行一次"},{"id":"C","label":"C","text":"do-while 先判断条件再执行循环体"},{"id":"D","label":"D","text":"两者都可以使用 break 退出"}],
    "correctOptionIds": ["A","B","D"], "explanation": "while 先判断；do-while 先执行后判断，所以至少执行一次；两种循环都可以用 break 退出。",
    "difficulty": 1, "tags": ["while", "do-while"], "status": "active", "version": 1
  },
  {
    "id": "cpp016", "chapterId": "control-functions", "chapterName": "流程控制与函数", "chapterOrder": 2,
    "type": "single", "stem": "下列哪种值不能直接作为标准 C/C++ switch 语句的控制表达式？",
    "options": [{"id":"A","label":"A","text":"int"},{"id":"B","label":"B","text":"char"},{"id":"C","label":"C","text":"枚举值"},{"id":"D","label":"D","text":"double"}],
    "correctOptionIds": ["D"], "explanation": "switch 控制表达式要求整数类型或枚举类型，浮点类型 double 不能直接使用。",
    "difficulty": 2, "tags": ["switch", "类型"], "status": "active", "version": 1
  },
  {
    "id": "cpp017", "chapterId": "control-functions", "chapterName": "流程控制与函数", "chapterOrder": 2,
    "type": "judge", "stem": "break 只会退出它所在的最内层循环或 switch，不会自动退出所有外层循环。",
    "options": [{"id":"A","label":"A","text":"正确"},{"id":"B","label":"B","text":"错误"}],
    "correctOptionIds": ["A"], "explanation": "普通 break 的作用范围是最内层循环或 switch；退出多层结构需要额外控制逻辑。",
    "difficulty": 1, "tags": ["break", "循环"], "status": "active", "version": 1
  },
  {
    "id": "cpp018", "chapterId": "control-functions", "chapterName": "流程控制与函数", "chapterOrder": 2,
    "type": "single", "stem": "循环中的 continue 语句通常表示什么？",
    "options": [{"id":"A","label":"A","text":"结束整个程序"},{"id":"B","label":"B","text":"跳过本次循环剩余语句，进入下一次迭代"},{"id":"C","label":"C","text":"永久停止循环"},{"id":"D","label":"D","text":"返回调用函数"}],
    "correctOptionIds": ["B"], "explanation": "continue 不结束循环，而是跳过本次迭代中其后的语句，并进入下一次迭代判断。",
    "difficulty": 1, "tags": ["continue", "循环"], "status": "active", "version": 1
  },
  {
    "id": "cpp019", "chapterId": "control-functions", "chapterName": "流程控制与函数", "chapterOrder": 2,
    "type": "single", "stem": "设计递归函数时，防止无限递归最关键的部分是什么？",
    "options": [{"id":"A","label":"A","text":"使用全局变量"},{"id":"B","label":"B","text":"设置能够到达的终止条件"},{"id":"C","label":"C","text":"把返回类型改为 void"},{"id":"D","label":"D","text":"每次递归都输出日志"}],
    "correctOptionIds": ["B"], "explanation": "递归必须有明确且可达的终止条件，并让问题规模逐步趋近该条件。",
    "difficulty": 1, "tags": ["递归", "终止条件"], "status": "active", "version": 1
  },
  {
    "id": "cpp020", "chapterId": "control-functions", "chapterName": "流程控制与函数", "chapterOrder": 2,
    "type": "judge", "stem": "函数内的 static 局部变量只初始化一次，其生命周期持续到程序结束。",
    "options": [{"id":"A","label":"A","text":"正确"},{"id":"B","label":"B","text":"错误"}],
    "correctOptionIds": ["A"], "explanation": "static 局部变量具有静态存储期，但作用域仍局限于声明它的代码块。",
    "difficulty": 2, "tags": ["static", "生命周期"], "status": "active", "version": 1
  },
  {
    "id": "cpp021", "chapterId": "control-functions", "chapterName": "流程控制与函数", "chapterOrder": 2,